<!ELEMENT CHRIST (CS+)>
<!ELEMENT CS (STU-NAME, STU-BRANCH, STU-COLLEGE, STU-EMAIL)>
<!ELEMENT STU-NAME (#PCDATA)>
<!ELEMENT STU-BRANCH (#PCDATA)>
<!ELEMENT STU-COLLEGE (#PCDATA)>
<!ELEMENT STU-EMAIL (#PCDATA)>